{
  "spec_version": "gfn/0.1",
  "type": "ACK",
  "notice_id": "urn:gfn:us-ca-sf-fire:2026-0912-0447",
  "sequence": 1,
  "operator_id": "urn:gfn:operator:example-av",
  "received_at": "2026-09-12T04:47:19Z",
  "disposition": "ACCEPTED_WITH_EXCEPTIONS",
  "vehicles_in_zone_at_receipt": 3,
  "routing_updated_at": "2026-09-12T04:47:34Z",
  "estimated_clear_at": "2026-09-12T04:51:00Z",
  "trips_diverted": 2,
  "exceptions": [
    {
      "vehicle_id": "AV-4471",
      "reason": "PHYSICALLY_BLOCKED",
      "detail": "Boxed in on Valencia St by parked apparatus. Vehicle is empty and awaiting a tow or apparatus movement.",
      "location": {
        "type": "Point",
        "coordinates": [
          -122.4203,
          37.7604
        ]
      },
      "expected_clear_at": "2026-09-12T05:30:00Z"
    }
  ],
  "contact": {
    "hotline": "+18005550177",
    "email": "public-safety@example-av.com"
  },
  "signature": {
    "protected": "eyJhbGciOiJFUzI1NiIsImtpZCI6ImV4YW1wbGUtYXYtb3BzLTIwMjYtMDEifQ",
    "signature": "PLACEHOLDER-detached-JWS-over-RFC8785-canonicalization-ES256"
  }
}
